{
  "version": "2.0",
  "endpoint_version": "analyze/v2",
  "engine_version": "1.0.0",
  "build": "near-tie-canary",
  "analysis_status": "computed",
  "robustness_status": "computed",
  "factor_sensitivity_status": "computed",
  "critiques": [],
  "options": [
    {
      "id": "opt_a",
      "outcome": {
        "mean": 10.5,
        "std": 2.1,
        "p10": 7.2,
        "p50": 10.4,
        "p90": 13.8,
        "n_samples": 1000,
        "n_valid_samples": 1000,
        "validity_ratio": 1
      },
      "win_probability": 0.48,
      "status": "computed"
    },
    {
      "id": "opt_b",
      "outcome": {
        "mean": 10.8,
        "std": 2.2,
        "p10": 7.3,
        "p50": 10.7,
        "p90": 14.1,
        "n_samples": 1000,
        "n_valid_samples": 1000,
        "validity_ratio": 1
      },
      "win_probability": 0.52,
      "status": "computed"
    }
  ],
  "robustness": {
    "level": "low",
    "confidence": 0.52,
    "recommendation_stability": 0.52,
    "fragile_edges": [
      {
        "edge_id": "factor_x->goal",
        "from_id": "factor_x",
        "to_id": "goal",
        "alternative_winner_id": "opt_a",
        "switch_probability": 0.48,
        "marginal_switch_probability": 0.04
      }
    ],
    "robust_edges": []
  },
  "factor_sensitivity": [
    {
      "node_id": "factor_x",
      "label": "Factor X",
      "sensitivity_score": 0.8,
      "elasticity": 0.75,
      "direction": "positive"
    }
  ]
}
